417,Female,Male,apolitical,Hindi,Graduated,committed,Atheist,Kolkata, Ableton Live Suite,Shaheed Bhagat Singh College (Evening),DIVYA JYOTI ACADEMY,It took me a long time not to judge myself through someone elses eyes. Sally Field,Johnson & Johnson,tanujdabas37
418,Female,Male,left,Hindi,Bought Vehicle,divorced,Hindu,Hyderabad,Mathematics ,Jesus & Mary College,GREENFINCH SCHOOL,,International Flavors & Fragrances,susy.andrat
419,,Male,,Tamil,New Job,committed,Sikh,Jaipur, C++,Bhagini Nivedita College,MOUNT PANDIM PRESTINE ACADEMY,"People are like stained-glass windows. They sparkle and shine when the sun is out, but when the darkness sets in their true beauty is revealed only if there is light from within. Elisabeth Kübler-Ross",SM Energy,kaashvi.pruthi
420,Male,Female,,Bengali,Graduated,complicated,Sikh,Visakhapatnam,C#,Vivekananda College,SA-VELLIE ROW,,PNC Financial Services,100005812693751
421,Female,Male,,Tamil,New Job,committed,Sikh,Visakhapatnam,Frequency analysis,Maharshi Valmiki College of Education,KARMA DHARMA CHAKRA UPS,"Take chances, make mistakes. Thats how you grow. Pain nourishes your courage. You have to fail in order to practice being brave. Mary Tyler Moore",Hyster-Yale Materials Handling,yatharth.ojha.90
422,Female,Male,apolitical,Tamil,Graduated,divorced,Hindu,Mumbai,Java,Sri Guru Gobind Singh College of Commerce,GOOD SHEPHERD SCHOOL,The only thing keeping you from getting what you want is the story you keep telling yourself about why you dont have it. People who are willing to die to succeed will tend to succeed. Tony Robbins,Barnes & Noble,shaurya.bagga.507
423,Male,,,Hindi,Graduated,committed,Hindu,Lucknow,Frequency analysis,Mata Sundri College for Women,MT OLIVES ENGLISH SCHOOL,"The secret is in not giving up, of all the greats they didnt quit. If you quit I guarantee youre gonna fail, but you dont know whats gunna happen if you dont give in. Eric Thomas",Murphy Oil,100016779841513
424,Female,Male,left,Hindi,Graduated,committed,Buddhism,Surat, CRMs,IIIT Ahemdabad,PRATAP INTERNATIONAL SCHOOL,Nothing lasts forever. Not even your troubles. Arnold H Glasgow,F5 Networks,arushi.dheer
425,Female,Male,apolitical,Bengali,Bought House,divorced,Buddhism,Jaipur, Ableton Live Suite,Shivaji College,"GYAN JYOTI ACADEMY,BURIAKHOP","People are like stained-glass windows. They sparkle and shine when the sun is out, but when the darkness sets in their true beauty is revealed only if there is light from within. Elisabeth Kübler-Ross",Teradyne,renny.toppo
426,Male,Female,apolitical,Tamil,New Job,married,Sikh,Delhi, Google Search Console Operator,Indira Gandhi Institute of Physical Education & Sports Sciences,NORTH SIKKIM ACADEMY,"Its not the size of the dog in the fight, but the size of the fight in the dog. Archie Griffen",HC2 Holdings,jaspreetsmarwah
427,Male,Female,right,English,Married,divorced,Sikh,,C#,Sri Venkateswara College,NEW LIGHT ACADEMY,,Cintas,tirkey.patras
428,Male,Female,left,Bengali,Graduated,committed,Hindu,Bangalore,Java,Gargi College,LITTLE ANGELS ACADEMY,,Sabre,jagdeep.lather.1
429,Male,Female,left,English,Bought House,divorced,Sikh,Chennai, Google Search Console Operator,Holy Family College of Nursing,JUBILANT SCHOOL,"Youre going to fail your way to success, you have nothing to be ashamed of so keep your head up. It’s much easier to come up with excuses of why you cant do it. If you do what is easy your life will be hard. Les Brown",Hexcel,aatish.chauhan.790
430,Male,Female,left,Tamil,New Job,single,Jainism,Surat,C#,Aryabhatta College(Formally Ram Lal Anand College-Evg.),SIKKIM HIMALAYAN ACADEMY,"Youre going to fail your way to success, you have nothing to be ashamed of so keep your head up. It’s much easier to come up with excuses of why you cant do it. If you do what is easy your life will be hard. Les Brown",UGI,100009490171036
431,Female,Male,apolitical,Hindi,Bought Vehicle,single,,Surat, Google Analytics,Bharati College,SPLENDOUR ACADEMY,It took me a long time not to judge myself through someone elses eyes. Sally Field,Teradata,rishabh.khurana.50
432,,Female,right,Hindi,Married,single,Sikh,Visakhapatnam,Accounting ,Deen Dayal Upadhyaya College,SWARSWATI BAL VIDHALAYA,Nothing lasts forever. Not even your troubles. Arnold H Glasgow,Chesapeake Energy,pari.arora.712714
433,Male,Female,right,Hindi,Bought House,divorced,Sikh,Hyderabad,,Aryabhatta College(Formally Ram Lal Anand College-Evg.),PHUSPANJALI VIDHALAYA,"Its not the size of the dog in the fight, but the size of the fight in the dog. Archie Griffen",News Corp.,100007926002513
434,Female,Male,,English,,live-in,Buddhism,, Google Analytics,Acharya Narendra Dev College,PARAMOUNT ACADEMY,The only place you find success before work is in the dictionary. May V Smith,International Flavors & Fragrances,ayushi.yadav.712
435,Male,Female,,Tamil,Married,complicated,Hindu,, Scala,Kalindi College for Women,SUNMARG ACADEMY,It took me a long time not to judge myself through someone elses eyes. Sally Field,Xilinx,garv.madan
436,Female,Male,left,Punjabi,Bought House,live-in,Sikh,Delhi, Google Analytics,Amar Jyoti Institute of Physiotherapy,RAMAN HIDDEN VALLEY ACADEMY,,Corning,shreya.srivatsan.22
437,Male,Female,left,Hindi,Married,single,Sikh,Hyderabad,Adobe Creative Suite,Lakshmi Bai College for Women,MOUNT ZION ACADEMY HEE,,Nordson,edwin.soreng
438,,,left,,New Job,single,Hindu,Jaipur,Frequency analysis,Ayurvedic & Unani Tibia College,ST MARRYS CONVENT,It took me a long time not to judge myself through someone elses eyes. Sally Field,PerkinElmer,shohini.ahuja
439,Male,Female,apolitical,English,Bought House,complicated,Christian,Chennai,Accounting ,Ayurvedic & Unani Tibia College,MOTHER TERESA MEMORIAL SCHOOL,,Equinix,Bhupeender
440,Female,Male,apolitical,Hindi,Married,committed,,Kanpur, forklifting,IIIT Ahemdabad,PALKHANG ACADEMY,I quit being afraid when my first venture failed and the sky didnt fall down. Allen H Neuharth,Marathon Oil,ashiliene.francis.9
441,Female,,apolitical,English,Bought Vehicle,complicated,Hindu,, operating a PoS,Delhi Institute of Pharmaceutical Sciences and Research,HAPPY HOURS (PVT),It took me a long time not to judge myself through someone elses eyes. Sally Field,Equifax,deepanshu.yadav.148
442,,Female,apolitical,Punjabi,Bought House,,Buddhism,Delhi, Google Analytics,Dyal Singh College (Evening),ANSHU ACADEMY,,IQVIA Holdings,100009695940187
443,Female,Male,,Bengali,Married,divorced,Christian,Jaipur, bookkeeping,Ramjas College,EBENEZER ACADEMY,It took me a long time not to judge myself through someone elses eyes. Sally Field,Ross Stores,kingikjot.wadhwa
444,Female,Male,,Hindi,Bought Vehicle,committed,Muslim,Delhi, forklifting,Ahilya Bai College of Nursing,WISDOM LAKE,"Just decide; whats its gonna be, who youre gonna be and how your gonna do it, and then from that point, the universe will get out of your way. Will Smith",Univar,abin.paul.37
445,Female,Male,apolitical,Tamil,Married,married,Christian,Lucknow,C#,Ramanujan College,EVERGREEN ENGLISH SCHOOL,I quit being afraid when my first venture failed and the sky didnt fall down. Allen H Neuharth,Dominion Energy,reena.rajeev.142
446,Male,Female,right,Hindi,,live-in,Hindu,Chennai, Crystallization ,Maulana Azad Medical College,AMBIKA DAHAL MEM. SCHOOL (PVT),I quit being afraid when my first venture failed and the sky didnt fall down. Allen H Neuharth,Insperity,mansha.gandhi.98
447,Female,Male,right,Hindi,New Job,divorced,Jainism,Kolkata, Crystallization ,Shaheed Bhagat Singh College,EVERSHINE ACADEMY,"Just decide; whats its gonna be, who youre gonna be and how your gonna do it, and then from that point, the universe will get out of your way. Will Smith",Service Corp. International,manav.kakkar.1257
448,Male,Female,,Hindi,New Job,live-in,Hindu,Nagpur, CRMs,St. Stephen's College,MATRI ACADEMY,"Hope never abandons you, you abandon it. George Weinberg",Hartford Financial Services,sudhanshu.kumar36
449,Female,Male,,,,complicated,,Kolkata, Google Search Console Operator,Kamla Nehru College for Women,MT. EVEREST SCHOOL,,Dell Technologies,100009832142943
450,Female,Male,right,Tamil,Bought House,committed,Muslim,,Adobe Creative Suite,Rajkumari Amrit Kaur College of Nursing,SARASWATI SISHU VIDYALAYA,,Ross Stores,akshit1511
451,Female,Male,left,Bengali,Graduated,single,Hindu,Lucknow,Adobe Creative Suite,Sri Aurobindo College,LABDANG ENGLISH SCHOOL,I quit being afraid when my first venture failed and the sky didnt fall down. Allen H Neuharth,Hospitality Properties Trust,bhavleen.taneja
452,,Other,apolitical,,Bought Vehicle,committed,Christian,Kolkata, C++,Maulana Azad Institute of Dental Sciences,MANJUSRI PUBLIC SCHOOL,"Take chances, make mistakes. Thats how you grow. Pain nourishes your courage. You have to fail in order to practice being brave. Mary Tyler Moore",Brown & Brown,ridhima.garg.961
453,,Male,apolitical,Hindi,Married,complicated,Hindu,Ahmedabad, Google Search Console Operator,Swami Shraddhanand College,DOLPHIN ACADEMY,The only place you find success before work is in the dictionary. May V Smith,Apple,prabhjot.m.singh
454,Female,Male,right,Hindi,New Job,live-in,Buddhism,Kanpur,Java,Delhi Institute of Pharmaceutical Sciences and Research,ST MARY SCHOOL,"Aerodynamically the bumblebee shouldnt be able to fly, but the bumblebee doesnt know that so it goes on flying anyway. Mary Kay Ash",Waters,shriya.narayanan.9
455,,Male,apolitical,Tamil,Bought Vehicle,divorced,Muslim,Lucknow, pallet-stacker,IIT Mandi,SUNRISE SCHOOL (PVT),The only thing keeping you from getting what you want is the story you keep telling yourself about why you dont have it. People who are willing to die to succeed will tend to succeed. Tony Robbins,Chemours,dhruvvermaa
456,Female,Male,apolitical,Hindi,Graduated,divorced,Hindu,Bangalore,operating a road roller,Moti Lal Nehru College,SARASWATI VIDYA NIKETAN,I quit being afraid when my first venture failed and the sky didnt fall down. Allen H Neuharth,William Lyon Homes,aishwarya.verghese
457,Female,Male,left,Tamil,Bought House,married,Sikh,Delhi, Google Analytics,Delhi Institute of Pharmaceutical Sciences and Research,TSUGLAGKHANG MONASTIC SCHOOL,"Its not the size of the dog in the fight, but the size of the fight in the dog. Archie Griffen",Becton Dickinson,kashish.kukreja.186
458,Female,Male,right,English,,divorced,Hindu,Pune, bookkeeping,National Institute of Health & Family Welfare,SARASWATI VIDYA NIKETAN,,Hawaiian Electric Industries,vaibhav.sarda.1232
459,Male,Female,right,,New Job,divorced,,Hyderabad,Adobe Creative Suite,Delhi College of Arts & Commerce,SKYLARK ACADEMY,"Its not the size of the dog in the fight, but the size of the fight in the dog. Archie Griffen",Triple-S Management,arushi.sawhney.3
460,Male,Female,,Hindi,Married,live-in,Hindu,Ahmedabad, Google Analytics,Acharya Narendra Dev College,SYARI MODEL SCHOOL,,Hub Group,saurav.kundu.9480
461,Female,Male,,Punjabi,,complicated,Hindu,Lucknow,Java,,KYI-DE-KHANG SEC.SCHOOL,,Curtiss-Wright,anchit.v.pandey
462,Female,Male,left,English,Married,committed,Hindu,Bangalore,Accounting ,Delhi Institute of Pharmaceutical Sciences and Research,SUN RISE ACADEMY,,Martin Marietta Materials,shivang.chandna
463,Female,Male,right,Bengali,,,,Ahmedabad, ERP systems,Satyawati College (Evening),RANGUTHANG HEDH-ZI-BAH,"If you don’t go after what you want, you’ll never have it. If you don’t ask, the answer is always no. If you don’t step forward, you’re always in the same place. Nora Roberts",Nordson,lavanya.verma.92560
464,,Male,apolitical,Punjabi,Married,complicated,Hindu,Jaipur, Stethoscope Usage,Kalindi College for Women,LITTLE ANGELS ACADEMY,,BrightView Holdings,Agastyavjha
465,Male,Female,,Hindi,Bought Vehicle,complicated,Jainism,Pune, operating a PoS,College of Art,ST. JOSHEP SS,"A life spent making mistakes is not only more honorable, but more useful than a life spent doing nothing. George Bernard Shaw",J.Crew Group,100005750508198
466,Male,Female,apolitical,,,single,Hindu,Delhi,Frequency analysis,College of Vocational Studies,SARASWATI SISHU VIDHLAYA,There are only two ways to live your life. One is as though nothing is a miracle. The other is as though everything is a miracle Albert Einstein,Allegheny Technologies,100007562835201
467,Female,Male,right,Tamil,Married,single,Buddhism,Lucknow, pallet-stacker,Mata Sundri College for Women,ST. JOSHEP SS,,Cracker Barrel Old Country Store,husain.khan.1023
468,Male,Female,left,,New Job,single,,Ahmedabad,C#,Sri Guru Nanak Dev Khalsa College,SARASWATI VIDYA NIKETAN,"People are like stained-glass windows. They sparkle and shine when the sun is out, but when the darkness sets in their true beauty is revealed only if there is light from within. Elisabeth Kübler-Ross",Apache,ayush.ns9
469,,Male,left,English,Bought Vehicle,live-in,Buddhism,Jaipur, pallet-stacker,Delhi Institute of Pharmaceutical Sciences and Research,HOLY FAITH ENGLISH SCHOOL,,TreeHouse Foods,bfuelu/
470,Male,Female,right,English,New Job,,Atheist,Surat,operating a road roller,Deshbandhu College(Morning),LITTLE SCHOLRS ACADEMY,,Exelon,arunesh.singh.52
471,Male,,right,Hindi,Married,single,Christian,Chennai, forklifting,College of Art,RISING NURSERY ACADEMY (PVT),"People are like stained-glass windows. They sparkle and shine when the sun is out, but when the darkness sets in their true beauty is revealed only if there is light from within. Elisabeth Kübler-Ross",State Farm Insurance,colleze.snek.5
472,Male,Female,apolitical,Hindi,,single,Hindu,Delhi, forklifting,Shri Ram College of Commerce,SARASWATI VIDHYA ACADEMY,"Take chances, make mistakes. Thats how you grow. Pain nourishes your courage. You have to fail in order to practice being brave. Mary Tyler Moore",Marriott International,divyansh.dixit.3
473,,,,Hindi,Married,married,Hindu,Bangalore,R,Vivekananda College,LITTLE ANGELS ACADEMY,,AptarGroup,100009582011007
474,Male,Female,right,Punjabi,Graduated,divorced,Buddhism,Kolkata, Crystallization ,Acharya Narendra Dev College,MT. EVEREST SCHOOL,I quit being afraid when my first venture failed and the sky didnt fall down. Allen H Neuharth,Hershey,rishita.41
475,,,,,New Job,live-in,Hindu,Pune,Frequency analysis,Pt. Deendayal Upadhyaya Institute of Physically Handicapped,LITTLE STARS ACADEMY,,ADP,navya.baid.11
476,,Female,right,Bengali,Graduated,married,Atheist,Pune,SEM Marketing,Deshbandhu College(Morning),GRACE ACADEMY,"If you don’t go after what you want, you’ll never have it. If you don’t ask, the answer is always no. If you don’t step forward, you’re always in the same place. Nora Roberts",CDW,simona.shamim
477,Male,,apolitical,Bengali,Graduated,live-in,Hindu,Delhi,Java,Keshav Mahavidyalaya,LORETO CONVENT SCHOOL,"Aerodynamically the bumblebee shouldnt be able to fly, but the bumblebee doesnt know that so it goes on flying anyway. Mary Kay Ash",Brown-Forman,tanishgupta1998
478,Female,,,,Bought Vehicle,committed,Sikh,Lucknow,Mathematics ,Maharaja Agarsen College,KING GEORGE ACADEMY,"Aerodynamically the bumblebee shouldnt be able to fly, but the bumblebee doesnt know that so it goes on flying anyway. Mary Kay Ash",Service Corp. International,rishabh.sabharwal.1
479,Male,Female,left,Tamil,Bought House,,Jainism,Lucknow, C++,Satyawati College,FUTURE BRIGHTER ACADEMY,"If you don’t go after what you want, you’ll never have it. If you don’t ask, the answer is always no. If you don’t step forward, you’re always in the same place. Nora Roberts",Syneos Health,gandharv.mohan.98
480,Male,Female,right,English,,complicated,Muslim,Nagpur, ERP systems,Vallabhbhai Patel Chest Institute,TENDER FEET ACADEMY,"Its not the size of the dog in the fight, but the size of the fight in the dog. Archie Griffen",Calumet Specialty Products,scooby7shaggy
481,Male,,apolitical,Bengali,Graduated,,Jainism,Delhi, Google Analytics,IIIT Ahemdabad,"BAHAI SCHOOL, SARAMSA",,Constellation Brands,khushali.verma.27
482,Male,Female,,Hindi,Graduated,single,,Nagpur, CRMs,College of Vocational Studies,SHERAB ODSAL RAIDELLING ACADEMY,,Colfax,chandan.bamba.9
483,Male,Female,right,English,Married,,Sikh,Bangalore, bookkeeping,Kamla Nehru College for Women,KARMA DHARMA CHAKRA UPS,,Chico's FAS,kshitij.agrawal.739
484,Male,,left,Bengali,Married,single,Jainism,Jaipur,Mathematics ,Zakir Husain Delhi College,PADMA KUMARI PUBLIC,"Aerodynamically the bumblebee shouldnt be able to fly, but the bumblebee doesnt know that so it goes on flying anyway. Mary Kay Ash",Zions Bancorp.,aparna.bhalla.7
485,Male,Female,right,English,Bought House,single,Atheist,Kanpur,Java,Netaji Subhash Institute of Technology,LITTLE STARS ACADEMY,,Quest Diagnostics,monica.joy.524
486,Male,Female,right,Hindi,Bought Vehicle,single,Christian,Ahmedabad, C++,Delhi Institute of Pharmaceutical Sciences and Research,NEW HORIZON ACADEMY,,Jefferies Financial Group,rishabhsetiya
487,Female,Male,apolitical,Bengali,Bought House,complicated,Hindu,Lucknow, Google Search Console Operator,Swami Shraddhanand College,GREEN VALE ACADEMY,,International Paper,erin.thomas.79827
488,,,right,English,,committed,Hindu,Hyderabad, CRMs,Shyam Lal College (Evening),MANJUSHREE ACADEMY,"Hope never abandons you, you abandon it. George Weinberg",Alexion Pharmaceuticals,akhil.vaid.98
489,Female,Male,left,Hindi,Bought House,married,Jainism,Visakhapatnam, pallet-stacker,Deen Dayal Upadhyaya College,ST.PETER ENGLISH SCHOOL,"If you don’t go after what you want, you’ll never have it. If you don’t ask, the answer is always no. If you don’t step forward, you’re always in the same place. Nora Roberts",Western Union,100008568974947
490,,Male,right,English,,committed,,Delhi, forklifting,Lady Shri Ram College for Women,LITTLE FLOWER NURSERY (PRY),"Ive missed more than 9,000 shots in my career. Ive lost almost 300 games. Twenty-six times Ive been trusted to take the game-winning shot and missed. Ive failed over and over and over again in my life. And that is why I succeed. Michael Jordan",LPL Financial Holdings,divyam.bhagchandani
491,Male,Female,right,,Bought House,live-in,Jainism,Lucknow, Stethoscope Usage,Shaheed Rajguru College of Applied Sciences for Women,P.M.M. U. SMART ACADEMY,"Youre going to fail your way to success, you have nothing to be ashamed of so keep your head up. It’s much easier to come up with excuses of why you cant do it. If you do what is easy your life will be hard. Les Brown",Rexnord,100009335668501
492,Female,Female,apolitical,Bengali,New Job,complicated,Hindu,Ahmedabad,,Gargi College,VISION ACADEMY,"Youre going to fail your way to success, you have nothing to be ashamed of so keep your head up. It’s much easier to come up with excuses of why you cant do it. If you do what is easy your life will be hard. Les Brown",Kimberly-Clark,nisha.narayanan.03
493,Male,Female,apolitical,Bengali,Married,live-in,Hindu,Surat,,Bharati College,SARASWATI VIDYA NIKETAN,"Aerodynamically the bumblebee shouldnt be able to fly, but the bumblebee doesnt know that so it goes on flying anyway. Mary Kay Ash",Ross Stores,snigdha.gupta.7543
494,Female,Male,right,Hindi,Married,committed,Muslim,Kolkata,C#,Janki Devi Memorial College,HIMALAYAN BAPTISE SCHOOL,,Coca-Cola Consolidated,guneet.popli
495,Male,Female,apolitical,English,Bought House,single,Jainism,Pune, Google Search Console Operator,Florence Nightingale College of Nursing,ANUGRAH PS MANPUR,"Ive missed more than 9,000 shots in my career. Ive lost almost 300 games. Twenty-six times Ive been trusted to take the game-winning shot and missed. Ive failed over and over and over again in my life. And that is why I succeed. Michael Jordan",National Oilwell Varco,100014650274924
496,,Female,right,English,Bought Vehicle,married,Christian,Lucknow,Java,Miranda House,SAIPARTI VIDYA MANDIR,"Ive missed more than 9,000 shots in my career. Ive lost almost 300 games. Twenty-six times Ive been trusted to take the game-winning shot and missed. Ive failed over and over and over again in my life. And that is why I succeed. Michael Jordan",Cinemark Holdings,prakriti.sharma.5688
497,Male,Female,right,Hindi,New Job,married,Hindu,Jaipur,operating a road roller,Ramanujan College,PRATAP INTERNATIONAL SCHOOL,,Philip Morris International,rachit.jain.7169
498,Female,Male,apolitical,,,divorced,Atheist,Kanpur,C#,Janki Devi Memorial College,DIVYA JYOTI ACADEMY,"A life spent making mistakes is not only more honorable, but more useful than a life spent doing nothing. George Bernard Shaw",LKQ,IIITDelhiLibrary/
499,Male,Female,,English,Bought House,single,Hindu,Delhi,Adobe Creative Suite,Institute of Home Economics,HIMALAYAN ACADEMY,The only thing keeping you from getting what you want is the story you keep telling yourself about why you dont have it. People who are willing to die to succeed will tend to succeed. Tony Robbins,Las Vegas Sands,eiha.gandhi.9
500,,,left,Tamil,Bought Vehicle,,Atheist,Hyderabad, bookkeeping,Shri Ram College of Commerce,MODERN ACADEMY,,Lamb Weston Holdings,100005938181067
501,Male,Female,,Hindi,Married,live-in,Sikh,Delhi,operating a road roller,Ayurvedic & Unani Tibia College,SUNSHINE ACADEMY,"People are like stained-glass windows. They sparkle and shine when the sun is out, but when the darkness sets in their true beauty is revealed only if there is light from within. Elisabeth Kübler-Ross",Dean Foods,aakash.sehrawat.507
502,Male,Female,apolitical,English,Graduated,live-in,Buddhism,Jaipur,C#,Moti Lal Nehru College (Evening),SAI GURUKUL ACADEMY,,Costco Wholesale,abhimanyu.lakra.5
503,,Other,apolitical,Punjabi,Graduated,complicated,,Bangalore, operating a PoS,Lady Irwin College,NEW GARDEN ENG SACHOOL (PVT),I quit being afraid when my first venture failed and the sky didnt fall down. Allen H Neuharth,Southwestern Energy,sujay237
504,Female,Male,,Tamil,Married,single,,Jaipur, ERP systems,Shaheed Rajguru College of Applied Sciences for Women,PLAY AND LEARN NURSERY SCHOOL,"A life spent making mistakes is not only more honorable, but more useful than a life spent doing nothing. George Bernard Shaw",ConocoPhillips,parassharma1998
505,Female,Male,apolitical,,Bought House,single,Hindu,Bangalore, Crystallization ,St. Stephen's College,VIDHYA SAGAR ACADEMY LEGSHIP,"If you don’t go after what you want, you’ll never have it. If you don’t ask, the answer is always no. If you don’t step forward, you’re always in the same place. Nora Roberts",Steel Dynamics,mayank.rocks123
506,Male,Female,,English,Bought Vehicle,single,Hindu,Jaipur, C++,Lakshmi Bai College for Women,RAINDOW PRY (PVT),,PulteGroup,mathew.sebastian.98229
507,,Male,left,Hindi,Bought House,complicated,Buddhism,Ahmedabad, operating a PoS,Bhaskaracharya College of Applied Sciences,NEW GARDEN BDG. SCHOOL,,Triple-S Management,aman.jaat.545
508,Male,Female,apolitical,Hindi,,live-in,Jainism,Mumbai,Java,Hindu College,EUREKA RESIDENTIAL SCHOOL BRANCH II,,Brinker International,noel.tiny
509,Female,,apolitical,Hindi,Bought Vehicle,single,Buddhism,,Java,Lady Hardinge Medical College,HIMALAYAN RISING ACADEMY,The only thing keeping you from getting what you want is the story you keep telling yourself about why you dont have it. People who are willing to die to succeed will tend to succeed. Tony Robbins,Interactive Brokers Group,khushi.sachdeva.142
510,Female,Male,left,English,Bought Vehicle,single,Hindu,Hyderabad,Java,Aryabhatta College(Formally Ram Lal Anand College-Evg.),VENUS ACADEMY,"A life spent making mistakes is not only more honorable, but more useful than a life spent doing nothing. George Bernard Shaw",MetLife,snehashish.biswas.771
511,Female,Male,,,Graduated,single,,Nagpur,operating a road roller,Florence Nightingale College of Nursing,NEW RAYS ACADEMY,"Being strong means rejoicing in who you are, complete with imperfections. Margaret Woodhouse",Texas Instruments,prashansa.tanwar.39
512,Male,Female,left,Punjabi,New Job,,Muslim,Delhi, pallet-stacker,Janki Devi Memorial College,MOUNT ZION ACADEMY HEE,The only thing keeping you from getting what you want is the story you keep telling yourself about why you dont have it. People who are willing to die to succeed will tend to succeed. Tony Robbins,Old Republic International,jenifer.stanley.750
513,,Female,apolitical,Bengali,Graduated,,Hindu,Bangalore, Crystallization ,Kamla Nehru College for Women,JUBILANT SCHOOL,"Hope never abandons you, you abandon it. George Weinberg",Vishay Intertechnology,shivankar.sharma.5220
514,,Other,apolitical,Hindi,Bought House,divorced,,Delhi, C++,G.B. Pant Hospital,EUREKA RESIDENTIAL SCHOOL BRANCH II,,Toll Brothers,ponnurangam.kumaraguru
515,Female,Male,,,Married,single,Muslim,Bangalore, C++,Shaheed Rajguru College of Applied Sciences for Women,ANGLES ENGLISH SCHOOL,"Take chances, make mistakes. Thats how you grow. Pain nourishes your courage. You have to fail in order to practice being brave. Mary Tyler Moore",Zayo Group Holdings,100005123898543
516,Female,Male,left,Hindi,Bought Vehicle,divorced,Jainism,Mumbai,Mathematics ,Mata Sundri College for Women,SARASWATI VIDYA NIKETAN,,Costco Wholesale,100007517928300
517,Male,Female,right,Tamil,Married,married,Sikh,Delhi,Accounting ,Dyal Singh College,HOLY FAITH ENGLISH SCHOOL,"A life spent making mistakes is not only more honorable, but more useful than a life spent doing nothing. George Bernard Shaw",CarMax,pardeep.kundu.5
518,Female,Male,,,Graduated,live-in,Jainism,Surat, Google Search Console Operator,Daulat Ram College,HIMALAYAN ACADEMY LUNGCHOK,,TEGNA,vanshika.saluja.71
519,Female,Male,apolitical,Hindi,Graduated,married,Atheist,Delhi, operating a PoS,Keshav Mahavidyalaya,KING GEORGE ACADEMY,"Just decide; whats its gonna be, who youre gonna be and how your gonna do it, and then from that point, the universe will get out of your way. Will Smith",United Rentals,vidhi.lamba.1
520,Male,,apolitical,Hindi,Bought Vehicle,committed,Atheist,Surat, pallet-stacker,Maulana Azad Institute of Dental Sciences,BRIGHT LIFE ENGLISH SCHOOL,,Rockwell Automation,pujita.chanda.1
