315,Male,Female,left,Punjabi,Bought House,single,,Delhi,R,School of Open Learning ( Erstwhile School of Correspondence & Continuing Education),HIMALAYAN RISING ACADEMY,"People are like stained-glass windows. They sparkle and shine when the sun is out, but when the darkness sets in their true beauty is revealed only if there is light from within. Elisabeth Kübler-Ross",Thermo Fisher Scientific,sonali.swain.948
316,Male,Female,apolitical,English,,,,Ahmedabad,Adobe Creative Suite,Jesus & Mary College,AMBIKA DAHAL MEM. SCHOOL (PVT),"A life spent making mistakes is not only more honorable, but more useful than a life spent doing nothing. George Bernard Shaw",Juniper Networks,Shubh.m28
317,Male,Female,left,,Married,single,Buddhism,Kolkata,operating a road roller,Bharati College,CANARY BIRD ACADEMY,"Its not the size of the dog in the fight, but the size of the fight in the dog. Archie Griffen",Silgan Holdings,100017424158038
318,,Other,apolitical,,New Job,divorced,Hindu,Surat, bookkeeping,Nehru Homeopathic Medical College & Hospital,HIMALAYAN SARASWATI VIDYALAYA,"If you don’t go after what you want, you’ll never have it. If you don’t ask, the answer is always no. If you don’t step forward, you’re always in the same place. Nora Roberts",Gartner,parth.piplani.33
319,Male,Female,left,Punjabi,New Job,married,Jainism,Hyderabad, pallet-stacker,Janki Devi Memorial College,SARASWATI VIDYA NIKETAN,"Take chances, make mistakes. Thats how you grow. Pain nourishes your courage. You have to fail in order to practice being brave. Mary Tyler Moore",CA,shaney.waris.5
320,Female,Male,,Bengali,Bought House,single,Hindu,Delhi,Accounting ,Vivekananda College,SARASWATI SISHU NIKETAN,There are only two ways to live your life. One is as though nothing is a miracle. The other is as though everything is a miracle Albert Einstein,Expedia Group,bhumika.sachdeva05
321,,Male,apolitical,Tamil,,committed,Buddhism,Lucknow,SEM Marketing,College of Vocational Studies,LELIUM ACADEMY SCHOOL,,Zions Bancorp.,kartik.agarwal.9275
322,,Male,,,,divorced,Jainism,Kanpur, CRMs,Atma Ram Sanatan Dharma College,LITTLE FLOWER NURSERY SCHOOL,,Discovery,100027806822320
323,,Female,left,Hindi,Graduated,married,Hindu,Mumbai,R,Sri Guru Nanak Dev Khalsa College,NEW VISION ACADEMY,,Mattel,bhuvan.bhandari.986
324,,,left,Bengali,New Job,divorced,Atheist,Pune, Google Analytics,Delhi Institute of Pharmaceutical Sciences and Research,KALEZ VALEY ENGLISH SCHOOL,"Take chances, make mistakes. Thats how you grow. Pain nourishes your courage. You have to fail in order to practice being brave. Mary Tyler Moore",Marriott International,mihir.goyal.7
325,Male,Female,left,English,New Job,live-in,Atheist,Mumbai, CRMs,Janki Devi Memorial College,EVERSHINE ACADEMY,"Aerodynamically the bumblebee shouldnt be able to fly, but the bumblebee doesnt know that so it goes on flying anyway. Mary Kay Ash",Martin Marietta Materials,harshbandhey
326,Male,Female,right,English,,divorced,,Jaipur, Ableton Live Suite,Sri Guru Gobind Singh College of Commerce,WOODSTOCK SCHOOL SOMBAREY,It took me a long time not to judge myself through someone elses eyes. Sally Field,Walt Disney,rashie.grover
327,,Female,right,Punjabi,Graduated,committed,Hindu,Hyderabad, Ableton Live Suite,Lady Shri Ram College for Women,MANJUSHREE ENGLISH SCHOOL,I quit being afraid when my first venture failed and the sky didnt fall down. Allen H Neuharth,ServiceNow,nishu.sehfal
328,Female,Male,apolitical,English,Bought Vehicle,,,Pune,Mathematics ,IIT Bombay,ST MARY SCHOOL,,Cypress Semiconductor,annmaria.sagi.3
329,Female,Male,right,,Bought House,complicated,Christian,Visakhapatnam, Google Search Console Operator,Bharati College,KUSH HANG MEMORIAL ENGLISH SCHOOL,It took me a long time not to judge myself through someone elses eyes. Sally Field,Avaya Holdings,rachzzzzzzzzzz
330,,Male,right,Hindi,Bought House,complicated,,Kanpur,Mathematics ,Moti Lal Nehru College,KUSH HANG MEMORIAL ENGLISH SCHOOL,"The secret is in not giving up, of all the greats they didnt quit. If you quit I guarantee youre gonna fail, but you dont know whats gunna happen if you dont give in. Eric Thomas",Reliance Steel & Aluminum,anshika.bansal.167527
331,Male,,right,English,Married,single,Sikh,, forklifting,Indira Gandhi Institute of Physical Education & Sports Sciences,BETHANY SCHOOL,I quit being afraid when my first venture failed and the sky didnt fall down. Allen H Neuharth,HNI,alvin.shaji.9
332,Female,,left,Tamil,Graduated,single,Muslim,,,Holy Family College of Nursing,PEMA SAMPHEL ACADEMY,,Archer Daniels Midland,soumyadeep.paul.12345
333,Male,Female,,Punjabi,Graduated,single,Atheist,Visakhapatnam,,Keshav Mahavidyalaya,ROSHAN MEMORIAL ACADEMY,"Aerodynamically the bumblebee shouldnt be able to fly, but the bumblebee doesnt know that so it goes on flying anyway. Mary Kay Ash",Concho Resources,adityakhanna1999
334,Male,Female,apolitical,Tamil,Bought House,complicated,Hindu,Bangalore,operating a road roller,St. Stephen's College,SAI GURUKUL ACADEMY,"Just decide; whats its gonna be, who youre gonna be and how your gonna do it, and then from that point, the universe will get out of your way. Will Smith",Lennox International,vidit.jain.127
335,Male,Female,left,English,New Job,committed,Jainism,Nagpur,C#,IIT Bombay,SIKKIM HIMALAYAN ACADEMY,Nobody can make you feel inferior without your consent. Eleanor Roosevelt,Jacobs Engineering Group,shubham.malhotra.1023
336,Female,Male,right,,Graduated,committed,Atheist,Surat, Scala,Kasturba Hospital,LITTLE STARS ACADEMY,Nobody can make you feel inferior without your consent. Eleanor Roosevelt,Resolute Forest Products,snigdha.jose
337,Male,Female,,Punjabi,Married,single,Jainism,Mumbai, operating a PoS,Hindu College,SKYLARK ACADEMY,Nothing lasts forever. Not even your troubles. Arnold H Glasgow,Cummins,varnika.kairon
338,Female,,apolitical,Punjabi,Graduated,complicated,Sikh,Delhi,Mathematics ,University College of Medical Sciences,KING GEORGE ACADEMY,,Kohl's,ankur.rangi
339,,,,Hindi,,divorced,Buddhism,Delhi, pallet-stacker,Bhim Rao Ambedkar College,NORTHWAY ACADEMY,Nothing lasts forever. Not even your troubles. Arnold H Glasgow,AbbVie,100021867502828
340,Female,Male,,Hindi,Bought Vehicle,,Buddhism,Kolkata, C++,G.B. Pant Hospital,"LITTLE ANGEL ACADEMY, PIPALAY",I quit being afraid when my first venture failed and the sky didnt fall down. Allen H Neuharth,Adobe,ForGodandOfGod
341,Female,Male,,Hindi,Graduated,single,Sikh,Nagpur,C#,G.B. Pant Hospital,KALEZ VALEY ENGLISH SCHOOL,"People are like stained-glass windows. They sparkle and shine when the sun is out, but when the darkness sets in their true beauty is revealed only if there is light from within. Elisabeth Kübler-Ross",Worldpay,calvin.anthony.372
342,Male,Female,left,Hindi,Bought House,married,Hindu,Kanpur, forklifting,All India Institute of Ayurveda,STERLINE ACADEMY,"Its not the size of the dog in the fight, but the size of the fight in the dog. Archie Griffen",Iron Mountain,sprsh99
343,Male,Female,right,Hindi,Bought Vehicle,committed,Buddhism,Surat, ERP systems,Maitreyi College for Women,TENDER BUDS PRIVATE SCHOOL,,Kirby,dhruv.bobal.79
344,Female,Male,left,Tamil,Married,,Hindu,Hyderabad, Crystallization ,Rajkumari Amrit Kaur College of Nursing,PRASHANTI VIDYA GIRI,There are only two ways to live your life. One is as though nothing is a miracle. The other is as though everything is a miracle Albert Einstein,AutoZone,100010337056876
345,Female,Male,right,Hindi,New Job,single,Hindu,Lucknow, bookkeeping,Shri Ram College of Commerce,ST. THOMAS SCHOOL,There are only two ways to live your life. One is as though nothing is a miracle. The other is as though everything is a miracle Albert Einstein,Sinclair Broadcast Group,tejal.mahindru
346,Male,,left,,,,Muslim,Chennai, Crystallization ,IIT Kanpur,NORTH POINT SCHOOL,"Take chances, make mistakes. Thats how you grow. Pain nourishes your courage. You have to fail in order to practice being brave. Mary Tyler Moore",Eversource Energy,aayush.baghel.3
347,Male,Female,left,Punjabi,New Job,committed,Atheist,Nagpur, C++,Shaheed Bhagat Singh College (Evening),SUNRISE MODEL,,Bio-Rad Laboratories,priyanshi.bhardwaj.7
348,Female,,right,Bengali,Married,,Jainism,Delhi, C++,Durga Bai Deshmukh College of Special Edu.(VI),MOUNT CARMEL,"Aerodynamically the bumblebee shouldnt be able to fly, but the bumblebee doesnt know that so it goes on flying anyway. Mary Kay Ash",JELD-WEN Holding,ishita.dua1
349,Male,Female,,English,Married,single,Atheist,Visakhapatnam,Accounting ,Satyawati College (Evening),KHATEK PEMA CHOLING MONASTIC SCHOOL,,Macy's,joel.jerry3
350,,Male,left,Punjabi,Bought Vehicle,complicated,Christian,Chennai, Crystallization ,IIIT Delhi,KID FOUNDATION ENGLISH SCHOOL,"The secret is in not giving up, of all the greats they didnt quit. If you quit I guarantee youre gonna fail, but you dont know whats gunna happen if you dont give in. Eric Thomas",Paccar,100009375289848
351,,Other,right,Punjabi,,divorced,Sikh,Delhi, Google Analytics,,ST JOHN ENGLISH SCHOOL,The only place you find success before work is in the dictionary. May V Smith,Autodesk,simran.baxla.5
352,Female,,right,Tamil,Bought Vehicle,,,Chennai, Scala,Deen Dayal Upadhyaya College,TENDER BUDS ACADEMY,It took me a long time not to judge myself through someone elses eyes. Sally Field,Werner Enterprises,100003190676893
353,Male,Female,left,,,complicated,Muslim,Jaipur, Scala,Nehru Homeopathic Medical College & Hospital,IDEAL NURSURY SCHOOL,,Sanmina,himanshu.karwal.9
354,Male,Female,,Hindi,Graduated,married,Christian,Hyderabad, operating a PoS,Kamla Nehru College for Women,ST. THOMAS SCHOOL,"The secret is in not giving up, of all the greats they didnt quit. If you quit I guarantee youre gonna fail, but you dont know whats gunna happen if you dont give in. Eric Thomas",Genesis Healthcare,priya.kaushal.3956
355,Male,Female,right,Punjabi,Bought Vehicle,married,Hindu,Lucknow, Google Analytics,Lakshmi Bai College for Women,ST.TERESAS SCHOOL,"Youre going to fail your way to success, you have nothing to be ashamed of so keep your head up. It’s much easier to come up with excuses of why you cant do it. If you do what is easy your life will be hard. Les Brown",Apache,abhishrut.khanna
356,Male,Female,,English,Graduated,committed,Hindu,, ERP systems,IIT Kanpur,BRIGHT LIFE ACADEMY,,NiSource,agam.deep.5895
357,Female,Male,right,Tamil,Married,committed,Christian,Jaipur, Scala,Shyama Prasad Mukherji College for Women,ENLIGHTEN ACADEMY,The only place you find success before work is in the dictionary. May V Smith,American National Insurance,durvish.eklaudiya.5
358,Female,Male,left,English,Married,complicated,Hindu,Jaipur,Frequency analysis,Moti Lal Nehru College (Evening),IDEAL ACADEMY,"If you don’t go after what you want, you’ll never have it. If you don’t ask, the answer is always no. If you don’t step forward, you’re always in the same place. Nora Roberts",Middleby,vaibhav.pulastya
359,Male,Female,,Hindi,Bought House,complicated,,Pune,,Gargi College,"BAHAI SCHOOL, SARAMSA","Take chances, make mistakes. Thats how you grow. Pain nourishes your courage. You have to fail in order to practice being brave. Mary Tyler Moore",Kroger,pratham.bhasin.37
360,,Male,left,,New Job,live-in,Hindu,Ahmedabad, operating a PoS,Kamla Nehru College for Women,PRASHANT VIDYA MANDIR SS(PVT),,Global Partners,dennis.saji.3
361,Male,Female,apolitical,English,Bought Vehicle,married,,Chennai,SEM Marketing,Institute of Home Economics,SPLENDOUR ACADEMY,"People are like stained-glass windows. They sparkle and shine when the sun is out, but when the darkness sets in their true beauty is revealed only if there is light from within. Elisabeth Kübler-Ross",Republic Services,vaibhav.juneja.50
362,Male,Female,left,,,married,Hindu,Delhi,Frequency analysis,Jesus & Mary College,SUNRISE BOARDING SCHOOL (PVT),Nobody can make you feel inferior without your consent. Eleanor Roosevelt,L3 Technologies,smita.alice.16
363,Female,Female,,Hindi,Graduated,committed,Hindu,Delhi, Scala,Nehru Homeopathic Medical College & Hospital,PIONEER ACADEMY GYALSHING,Nothing lasts forever. Not even your troubles. Arnold H Glasgow,Foundation Building Materials,sakshi.saini.988711
364,Female,Male,left,Punjabi,,married,Atheist,Jaipur,Mathematics ,Bhaskaracharya College of Applied Sciences,RADIANT STARS ACADEMY,,Old Republic International,akhilesh.penta.1
365,,Male,left,Bengali,,live-in,Muslim,Ahmedabad, pallet-stacker,Institute of Human Behaviour & Allied Sciences,LITTLE SCHOLRS ACADEMY,The only place you find success before work is in the dictionary. May V Smith,NewMarket,100008342496129
366,Male,Female,right,Hindi,Bought Vehicle,divorced,Atheist,Chennai,C#,Sri Guru Gobind Singh College of Commerce,TOUCH WOOD ACADEMY,"Its not the size of the dog in the fight, but the size of the fight in the dog. Archie Griffen",Revlon,allen.steven.77
367,,Female,right,Hindi,Bought Vehicle,married,Atheist,Lucknow, Google Search Console Operator,Ram Lal Anand College,MARIGOLD NURSERY SCHOOL,"Take chances, make mistakes. Thats how you grow. Pain nourishes your courage. You have to fail in order to practice being brave. Mary Tyler Moore",Hartford Financial Services,lohanhemant
368,Male,Female,apolitical,Hindi,Married,single,Atheist,Jaipur,Frequency analysis,IIT Bombay,ST.LUTHER ENGLISH BOARDING SCHOOL,It took me a long time not to judge myself through someone elses eyes. Sally Field,Kennametal,shubham.malhotra.568
369,Male,Female,left,English,Married,divorced,Buddhism,Lucknow, CRMs,All India Institute of Ayurveda,GREEN HILL ACADEMY,,Graybar Electric,indumathi.sriram.7
370,Female,Male,apolitical,Bengali,New Job,divorced,Buddhism,Lucknow,R,Ram Lal Anand College,St. EDMUNDS ACADEMY GURUTHANG,I quit being afraid when my first venture failed and the sky didnt fall down. Allen H Neuharth,JPMorgan Chase,WeaveIIITD/
371,Male,Female,,English,New Job,committed,Hindu,Nagpur, Stethoscope Usage,Maharshi Valmiki College of Education,RAINDOW PRY (PVT),"The secret is in not giving up, of all the greats they didnt quit. If you quit I guarantee youre gonna fail, but you dont know whats gunna happen if you dont give in. Eric Thomas",Adobe,hritik.malhotra.9
372,Female,Male,right,Bengali,Bought House,divorced,Sikh,Delhi,C#,Bhaskaracharya College of Applied Sciences,INDRAKIL SARASWATI VIDHALAYA,"People are like stained-glass windows. They sparkle and shine when the sun is out, but when the darkness sets in their true beauty is revealed only if there is light from within. Elisabeth Kübler-Ross",W.W. Grainger,harshit.kanojia.9
373,,Male,left,English,Bought House,single,Jainism,Surat,Mathematics ,Nehru Homeopathic Medical College & Hospital,VIDYA BHARATI NAYABAZAR,"Ive missed more than 9,000 shots in my career. Ive lost almost 300 games. Twenty-six times Ive been trusted to take the game-winning shot and missed. Ive failed over and over and over again in my life. And that is why I succeed. Michael Jordan",Whiting Petroleum,iamagambajaj
374,Female,Male,right,Punjabi,Bought Vehicle,divorced,Sikh,Kolkata,Frequency analysis,Delhi Institute of Pharmaceutical Sciences and Research,ANUGRAH PS MANPUR,It took me a long time not to judge myself through someone elses eyes. Sally Field,State Farm Insurance,shruti.dabas.10
375,Male,Female,apolitical,,Married,single,Atheist,Lucknow, ERP systems,Ahilya Bai College of Nursing,MODERN ACADEMY,,Martin Marietta Materials,mohit.arora.180
376,,Male,,English,Bought Vehicle,single,Hindu,Kolkata, Ableton Live Suite,Shyama Prasad Mukherji College for Women,NORTHWAY ACADEMY,"Take chances, make mistakes. Thats how you grow. Pain nourishes your courage. You have to fail in order to practice being brave. Mary Tyler Moore",Hewlett Packard Enterprise,chirag.malhotra.507
377,Male,Female,apolitical,Hindi,Bought Vehicle,complicated,Buddhism,Surat, Scala,Gargi College,ANGLES ENGLISH SCHOOL,"Take chances, make mistakes. Thats how you grow. Pain nourishes your courage. You have to fail in order to practice being brave. Mary Tyler Moore",Zebra Technologies,sarthakdua27
378,Female,Male,apolitical,,Bought Vehicle,complicated,,Mumbai, Google Search Console Operator,IIT Delhi,SUNRISE BOARDING SCHOOL (PVT),,Euronet Worldwide,preyansh.rastogi
379,Female,Male,left,Hindi,New Job,,Jainism,,operating a road roller,Mata Sundri College for Women,MOUNT CARMEL SCHOOL,,Applied Materials,harshit.garg.98284
380,,Female,,Tamil,Bought House,married,Sikh,Surat, Scala,Ayurvedic & Unani Tibia College,LITTLE BUD,"If you don’t go after what you want, you’ll never have it. If you don’t ask, the answer is always no. If you don’t step forward, you’re always in the same place. Nora Roberts",Veritiv,steve.james.1232
381,Male,Female,,Punjabi,Bought House,,Hindu,Delhi, bookkeeping,Sri Guru Tegh Bahadur Khalsa College,POLE STAR ENGLISH SCHOOL HEE,"A life spent making mistakes is not only more honorable, but more useful than a life spent doing nothing. George Bernard Shaw",Crestwood Equity Partners,sharma1299raghav
382,Female,,right,Tamil,Bought Vehicle,complicated,Hindu,Delhi,Frequency analysis,Sri Guru Gobind Singh College of Commerce,NEW HORIZON ACADEMY,,Hertz Global Holdings,singh.yashvardhan29
383,Female,Male,apolitical,Hindi,Bought Vehicle,married,Buddhism,Kolkata,,IIT Delhi,SARASWATI SISHU VIDYALAYA,Nothing splendid has ever been achieved except by those who dared believe that something inside of them was superior to circumstance. Bruce Barton,Peabody Energy,kundu.sanjay
384,Female,Male,left,Hindi,Bought Vehicle,married,Atheist,,Mathematics ,Chacha Nehru Bal Chikitsalaya,SUNRISE BOARDING SCHOOL (PVT),,IDEXX Laboratories,mukulchhabra123
385,Female,Male,,English,Graduated,complicated,Hindu,Mumbai,Adobe Creative Suite,G.B. Pant Hospital,RIVERINE ELEMENTRY SCHOOL,"Its not the size of the dog in the fight, but the size of the fight in the dog. Archie Griffen",Western Union,maanika.arora
386,Female,Male,right,English,Graduated,married,Jainism,Chennai,R,Zakir Husain Post Graduate Evening College,LITTLE ANGEL ACADEMY,"People are like stained-glass windows. They sparkle and shine when the sun is out, but when the darkness sets in their true beauty is revealed only if there is light from within. Elisabeth Kübler-Ross",Stifel Financial,senskori.boi
387,Male,,,,,committed,,, C++,IIT Delhi,PRASHANTI VIDYA GIRI,"Being strong means rejoicing in who you are, complete with imperfections. Margaret Woodhouse",Range Resources,anant.john
388,,Male,right,English,Bought House,,Atheist,Bangalore, Ableton Live Suite,Amar Jyoti Institute of Physiotherapy,EUREKA RESIDENTIAL SCHOOL BRANCH II,,Foot Locker,chaudhary.sunnyrathee
389,,Male,apolitical,Hindi,Bought House,married,Hindu,Pune,Adobe Creative Suite,Shyama Prasad Mukherji College for Women,VENUS ACADEMY,Nothing splendid has ever been achieved except by those who dared believe that something inside of them was superior to circumstance. Bruce Barton,Prologis,aanchal.kapai
390,Male,Female,left,Bengali,,divorced,Buddhism,Bangalore, Crystallization ,Satyawati College (Evening),HIMALAYAN BAPTISE SCHOOL,,Best Buy,stutirawat1D
391,Male,Female,apolitical,Hindi,,complicated,Jainism,Kanpur, Stethoscope Usage,Ayurvedic & Unani Tibia College,SIKKIM HOMES ACADEMY,"Just decide; whats its gonna be, who youre gonna be and how your gonna do it, and then from that point, the universe will get out of your way. Will Smith",New Residential Investment,mayan.bhandari.18
392,Male,Female,,Hindi,Graduated,complicated,,Visakhapatnam,operating a road roller,Kasturba Hospital,KYI-DE-KHANG SEC.SCHOOL,"A life spent making mistakes is not only more honorable, but more useful than a life spent doing nothing. George Bernard Shaw",Plexus,deepankar.aggarwal.12
393,Male,Female,apolitical,Hindi,,live-in,Buddhism,Kolkata, operating a PoS,Lady Irwin College,SAIPARTI VIDYA MANDIR,,3M,nehabhairavi.prakriya
394,Female,Male,apolitical,Punjabi,Graduated,single,Buddhism,Ahmedabad, Scala,Sri Guru Gobind Singh College of Commerce,EBENEZER ACADEMY,Nothing splendid has ever been achieved except by those who dared believe that something inside of them was superior to circumstance. Bruce Barton,Humana,hardik.gauba.90
395,Male,Female,,Hindi,,divorced,Jainism,Visakhapatnam, Google Analytics,Indira Gandhi Institute of Physical Education & Sports Sciences,SA-VELLIE ROW,"Aerodynamically the bumblebee shouldnt be able to fly, but the bumblebee doesnt know that so it goes on flying anyway. Mary Kay Ash",Tailored Brands,dilkiran.taneja
396,Male,Female,,Tamil,,single,Sikh,Delhi, bookkeeping,College of Art,SHALOM ACADEMY,I quit being afraid when my first venture failed and the sky didnt fall down. Allen H Neuharth,salesforce.com,notmanan
397,Female,,,Hindi,Married,divorced,Hindu,Delhi, Google Search Console Operator,Indraprastha College for Women,Rainbow Academy,"Ive missed more than 9,000 shots in my career. Ive lost almost 300 games. Twenty-six times Ive been trusted to take the game-winning shot and missed. Ive failed over and over and over again in my life. And that is why I succeed. Michael Jordan",Steel Dynamics,nayan.arora.94
398,Female,Male,apolitical,Hindi,Graduated,married,Atheist,Nagpur, Stethoscope Usage,Shyama Prasad Mukherji College for Women,NEW LIGHT ACADEMY,The only thing keeping you from getting what you want is the story you keep telling yourself about why you dont have it. People who are willing to die to succeed will tend to succeed. Tony Robbins,Fifth Third Bancorp,100004361920689
399,Male,Female,left,Hindi,Married,live-in,Muslim,Bangalore,Accounting ,Dyal Singh College (Evening),GREEN VALE ACADEMY,"Just decide; whats its gonna be, who youre gonna be and how your gonna do it, and then from that point, the universe will get out of your way. Will Smith",Moog,100010433745280
400,Female,,apolitical,,,married,Hindu,Delhi, Stethoscope Usage,Maharaja Agarsen College,LITTLE SCHOLRS ACADEMY,"People are like stained-glass windows. They sparkle and shine when the sun is out, but when the darkness sets in their true beauty is revealed only if there is light from within. Elisabeth Kübler-Ross",AMN Healthcare Services,abhishek.sabu.129
401,Male,Female,left,English,Graduated,,Atheist,Surat, Scala,Shaheed Sukhdev College of Business Studies,RIVERINE ELEMENTRY SCHOOL,,Wabash National,100015978780822
402,Male,Female,apolitical,Bengali,New Job,divorced,Atheist,, ERP systems,School of Open Learning ( Erstwhile School of Correspondence & Continuing Education),PADMA ODZER CHOLING,,Acadia Healthcare,aryan.khosla.1
403,Female,Male,right,Punjabi,Married,,Atheist,Kolkata,Accounting ,IIT Delhi,TINY PEARLS SCHOOL,,3M,gargarjun14
404,Male,Female,,English,Graduated,single,Muslim,Jaipur,R,Kirori Mal College,EUREKA RESIDENTIAL SCHOOL,"Ive missed more than 9,000 shots in my career. Ive lost almost 300 games. Twenty-six times Ive been trusted to take the game-winning shot and missed. Ive failed over and over and over again in my life. And that is why I succeed. Michael Jordan",Crane,athira.james.3
405,Female,Male,,Hindi,,live-in,Buddhism,Pune, pallet-stacker,Sri Guru Nanak Dev Khalsa College,ANSHU ACADEMY,"Aerodynamically the bumblebee shouldnt be able to fly, but the bumblebee doesnt know that so it goes on flying anyway. Mary Kay Ash",Huntsman,kritika.029
406,Female,Male,right,English,Graduated,committed,Christian,Chennai, Google Search Console Operator,Shaheed Rajguru College of Applied Sciences for Women,GREEN VALE ACADEMY,,IDEX,kapeesh.shukla
407,,,apolitical,Punjabi,Graduated,divorced,Hindu,Bangalore,Frequency analysis,Bhim Rao Ambedkar College,MOUNT PANDIM PRESTINE ACADEMY,The only thing keeping you from getting what you want is the story you keep telling yourself about why you dont have it. People who are willing to die to succeed will tend to succeed. Tony Robbins,BrightView Holdings,100008339340599
408,Female,Male,,English,Bought House,live-in,Jainism,, CRMs,Maitreyi College for Women,MT. EVEREST SCHOOL,,W.W. Grainger,mayank.malik.19
409,Female,Male,apolitical,English,Graduated,married,Atheist,Lucknow, Ableton Live Suite,Delhi Institute of Pharmaceutical Sciences and Research,DIVYA JYOTI SCHOOL (P),Nothing lasts forever. Not even your troubles. Arnold H Glasgow,GEO Group,chirag.sachdeva.568
410,Male,,apolitical,Punjabi,New Job,single,Hindu,Mumbai, operating a PoS,Sri Aurobindo College,EAST POINT ENGLISH SCHOOL,,Deluxe,100009422656740
411,Male,Female,apolitical,Hindi,Bought Vehicle,,Atheist,Mumbai,C#,Sri Guru Gobind Singh College of Commerce,BLOOSOM (PVT),"Ive missed more than 9,000 shots in my career. Ive lost almost 300 games. Twenty-six times Ive been trusted to take the game-winning shot and missed. Ive failed over and over and over again in my life. And that is why I succeed. Michael Jordan",Abercrombie & Fitch,jeenu.john.5243
412,Male,,apolitical,Punjabi,Graduated,,Hindu,Ahmedabad, operating a PoS,Shyam Lal College,ADARSH VIDHYA MANDIR,"Hope never abandons you, you abandon it. George Weinberg",AMN Healthcare Services,deepika.lohan
413,Male,Female,,Hindi,Bought House,single,Muslim,Lucknow,operating a road roller,Lakshmi Bai College for Women,GYANUDAYA ACADEMY MEMDOGOAN,"If you don’t go after what you want, you’ll never have it. If you don’t ask, the answer is always no. If you don’t step forward, you’re always in the same place. Nora Roberts",Nuance Communications,avisionx
414,Female,Male,right,English,,,Hindu,Surat, forklifting,Moti Lal Nehru College,ST. THOMAS SCHOOL,"People are like stained-glass windows. They sparkle and shine when the sun is out, but when the darkness sets in their true beauty is revealed only if there is light from within. Elisabeth Kübler-Ross",PG&E,harsh.anand.sat
415,Male,Female,left,Hindi,New Job,single,Jainism,Jaipur, ERP systems,Kalindi College for Women,PARADISE ACADEMY,"A life spent making mistakes is not only more honorable, but more useful than a life spent doing nothing. George Bernard Shaw",Triple-S Management,vian.pouldon
416,,Other,,,Married,single,Sikh,Visakhapatnam, C++,Rajkumari Amrit Kaur College of Nursing,LELIUM ACADEMY SCHOOL,,Ensign Group,ishika.sahni.98
